[
  {
    "id": "chembl_web_services",
    "name": "ChEMBL Web Services",
    "type": "api",
    "url": "https://www.ebi.ac.uk/chembl/ws",
    "description": "REST API for bioactive molecules, targets, and bioassays.",
    "tags": [
      "api"
    ],
    "tasks": [],
    "modalities": [
      "chemical-structure"
    ],
    "organism": [],
    "api": true,
    "entities": [
      "molecule",
      "protein"
    ],
    "documentation": "https://www.ebi.ac.uk/chembl/api/data/docs",
    "last_checked": "2026-08-08",
    "metadata_sources": [
      "https://www.ebi.ac.uk/chembl/api/data/docs"
    ]
  },
  {
    "id": "clinicaltrials_gov_api",
    "name": "ClinicalTrials.gov API",
    "type": "api",
    "url": "https://clinicaltrials.gov/api/gui",
    "description": "API for querying clinical trial metadata and results.",
    "tags": [
      "api"
    ],
    "tasks": [],
    "modalities": [
      "clinical"
    ],
    "organism": [],
    "api": true,
    "entities": [
      "disease",
      "drug"
    ],
    "documentation": "https://clinicaltrials.gov/data-api/api",
    "last_checked": "2026-08-08",
    "metadata_sources": [
      "https://clinicaltrials.gov/data-api/api"
    ]
  },
  {
    "id": "ensembl_rest_api",
    "name": "Ensembl REST API",
    "type": "api",
    "url": "https://rest.ensembl.org/",
    "description": "API for genomic annotations, variants, genes, and comparative genomics.",
    "tags": [
      "api"
    ],
    "tasks": [],
    "modalities": [
      "genomics"
    ],
    "organism": [],
    "api": true,
    "entities": [
      "gene",
      "genome",
      "transcript",
      "variant"
    ],
    "documentation": "https://rest.ensembl.org/",
    "last_checked": "2026-08-08",
    "metadata_sources": [
      "https://rest.ensembl.org/"
    ]
  },
  {
    "id": "kegg_rest_api",
    "name": "KEGG REST API",
    "type": "api",
    "url": "https://www.kegg.jp/kegg/rest/keggapi.html",
    "description": "API for accessing KEGG pathways, compounds, genes, and reactions.",
    "tags": [
      "api"
    ],
    "tasks": [],
    "modalities": [],
    "organism": [],
    "api": true,
    "entities": [
      "compound",
      "gene",
      "pathway"
    ],
    "documentation": "https://www.kegg.jp/kegg/rest/keggapi.html",
    "last_checked": "2026-08-08",
    "metadata_sources": [
      "https://www.kegg.jp/kegg/rest/keggapi.html"
    ]
  },
  {
    "id": "ncbi_e_utilities",
    "name": "NCBI E-utilities",
    "type": "api",
    "url": "https://www.ncbi.nlm.nih.gov/books/NBK25501/",
    "description": "Unified APIs for accessing NCBI databases (Gene, GEO, SRA, PubChem, etc).",
    "tags": [
      "api"
    ],
    "tasks": [],
    "modalities": [
      "genomics",
      "transcriptomics"
    ],
    "organism": [],
    "api": true,
    "entities": [
      "gene",
      "genome",
      "protein",
      "transcript",
      "variant"
    ],
    "documentation": "https://www.ncbi.nlm.nih.gov/books/NBK25501/",
    "last_checked": "2026-08-08",
    "metadata_sources": [
      "https://www.ncbi.nlm.nih.gov/books/NBK25501/"
    ]
  },
  {
    "id": "open_targets_platform_api",
    "name": "Open Targets Platform API",
    "type": "api",
    "url": "https://platform.opentargets.org/api",
    "description": "API for target–disease associations integrating genetics, genomics, and drug data.",
    "tags": [
      "api"
    ],
    "tasks": [],
    "modalities": [
      "genomics",
      "knowledge-graph"
    ],
    "organism": [],
    "api": true,
    "entities": [
      "disease",
      "drug",
      "gene",
      "variant"
    ],
    "documentation": "https://platform.opentargets.org/api",
    "last_checked": "2026-08-08",
    "metadata_sources": [
      "https://platform.opentargets.org/api"
    ]
  },
  {
    "id": "pubmed_e_utilities_esearch_efetch",
    "name": "PubMed E-utilities (esearch/efetch)",
    "type": "api",
    "url": "https://www.nlm.nih.gov/dataguide/edirect/esearch.html",
    "description": "APIs for searching and retrieving biomedical literature from PubMed.",
    "tags": [
      "api"
    ],
    "tasks": [],
    "modalities": [],
    "organism": [],
    "api": true,
    "documentation": "https://www.ncbi.nlm.nih.gov/books/NBK25501/",
    "last_checked": "2026-08-08",
    "metadata_sources": [
      "https://www.ncbi.nlm.nih.gov/books/NBK25501/"
    ]
  },
  {
    "id": "uniprot_rest_api",
    "name": "UniProt REST API",
    "type": "api",
    "url": "https://www.uniprot.org/help/api",
    "description": "Programmatic access to protein sequence and functional annotation data.",
    "tags": [
      "api"
    ],
    "tasks": [],
    "modalities": [
      "protein-sequence",
      "proteomics"
    ],
    "organism": [],
    "api": true,
    "entities": [
      "protein"
    ],
    "documentation": "https://www.uniprot.org/help/api",
    "last_checked": "2026-08-08",
    "metadata_sources": [
      "https://www.uniprot.org/help/api"
    ]
  },
  {
    "id": "1000_genomes_project",
    "name": "1000 Genomes Project",
    "type": "benchmark",
    "url": "https://www.internationalgenome.org/",
    "description": "Reference panel of human genetic variation from 2,504 individuals across 26 populations.",
    "tags": [
      "genomics-cancer-and-biomedical-cohorts"
    ],
    "tasks": [],
    "modalities": [],
    "organism": [],
    "api": false
  },
  {
    "id": "bace",
    "name": "BACE",
    "type": "benchmark",
    "url": "https://www.kaggle.com/datasets/gokturkkoch/bace",
    "description": "Binary classification and regression dataset for β-secretase 1 (BACE-1) inhibitor binding affinity.",
    "tags": [
      "molecular-protein-and-drug-discovery"
    ],
    "tasks": [
      "classification",
      "regression"
    ],
    "modalities": [
      "chemical-structure"
    ],
    "organism": [],
    "api": false,
    "entities": [
      "molecule",
      "protein"
    ],
    "last_checked": "2026-08-08",
    "metadata_sources": [
      "https://www.kaggle.com/datasets/gokturkkoch/bace"
    ]
  },
  {
    "id": "beat_aml",
    "name": "BEAT AML",
    "type": "benchmark",
    "url": "https://biodev.github.io/BeatAML2/",
    "description": "Functional ex vivo drug sensitivity measurements paired with genomics for acute myeloid leukemia.",
    "tags": [
      "drug-response-and-perturbation"
    ],
    "tasks": [
      "drug-response-prediction"
    ],
    "modalities": [
      "genomics"
    ],
    "organism": [],
    "api": false,
    "entities": [
      "cell",
      "disease",
      "drug",
      "gene"
    ],
    "last_checked": "2026-08-08",
    "metadata_sources": [
      "https://biodev.github.io/BeatAML2/"
    ],
    "dataset_profile": {
      "species": [
        "human"
      ],
      "sample_type": "patient",
      "biological_context": "cancer",
      "perturbation_type": [
        "chemical"
      ],
      "paired": true,
      "pre_post": false,
      "longitudinal": false,
      "drug_identity": true,
      "dose": true,
      "smiles": "partial",
      "clinical_outcome": true,
      "n_samples": "primary AML patient samples",
      "n_cells": null,
      "access": "open"
    }
  },
  {
    "id": "bento",
    "name": "Bento",
    "type": "benchmark",
    "url": "https://github.com/LigandPro/Bento",
    "description": "Protein-ligand docking benchmark covering rigid, flexible, de novo, blind, induced-fit, and covalent docking tasks.",
    "tags": [
      "molecular-protein-and-drug-discovery"
    ],
    "tasks": [],
    "modalities": [],
    "organism": [],
    "api": false
  },
  {
    "id": "bindingdb_curated_sets",
    "name": "BindingDB Curated Sets",
    "type": "benchmark",
    "url": "https://www.bindingdb.org/rwd/bind/chemsearch/marvin/SDFdownload.jsp?all_download=yes",
    "description": "Curated binding affinity datasets for protein–ligand interaction benchmarking.",
    "tags": [
      "molecular-protein-and-drug-discovery"
    ],
    "tasks": [
      "drug-target-interaction"
    ],
    "modalities": [
      "chemical-structure"
    ],
    "organism": [],
    "api": false,
    "entities": [
      "molecule",
      "protein"
    ],
    "last_checked": "2026-08-08",
    "metadata_sources": [
      "https://www.bindingdb.org/"
    ]
  },
  {
    "id": "cancer_therapeutics_response_portal_ctrp",
    "name": "Cancer Therapeutics Response Portal (CTRP)",
    "type": "benchmark",
    "url": "https://portals.broadinstitute.org/ctrp/",
    "description": "Drug sensitivity profiles across ~900 cancer cell lines for >400 compounds.",
    "tags": [
      "drug-response-and-perturbation"
    ],
    "tasks": [
      "drug-response-prediction"
    ],
    "modalities": [],
    "organism": [],
    "api": false,
    "entities": [
      "cell",
      "drug"
    ],
    "last_checked": "2026-08-08",
    "metadata_sources": [
      "https://portals.broadinstitute.org/ctrp/"
    ],
    "dataset_profile": {
      "species": [
        "human"
      ],
      "sample_type": "cell-line",
      "biological_context": "cancer",
      "perturbation_type": [
        "chemical"
      ],
      "paired": true,
      "pre_post": false,
      "longitudinal": false,
      "drug_identity": true,
      "dose": true,
      "smiles": "partial",
      "clinical_outcome": false,
      "n_samples": "~900 cancer cell lines",
      "n_cells": null,
      "access": "open"
    }
  },
  {
    "id": "chem_perturbridge",
    "name": "Chem-PerturBridge",
    "type": "benchmark",
    "url": "https://github.com/theislab/Chem-PerturBridge",
    "description": "Harmonized compendium and processing pipelines for small-molecule perturbation transcriptomics across heterogeneous assays and gene panels.",
    "tags": [
      "drug-response-and-perturbation"
    ],
    "tasks": [],
    "modalities": [],
    "organism": [],
    "api": false
  },
  {
    "id": "clintox",
    "name": "ClinTox",
    "type": "benchmark",
    "url": "https://tdcommons.ai/single_pred_tasks/tox/#clintox",